{
  "schema_version": "1.0",
  "evidence_id": "validation-evidence-42",
  "evaluation_run_id": "run-42",
  "created_at": "2026-10-10T03:00:00Z",
  "valid_until": "2099-01-01T00:00:00Z",
  "evaluator_principal_id": "independent-evaluation-service",
  "domain_id": "factory-maintenance-a",
  "candidate_bundle": {
    "sha256": "sha256:c538170f890a70d04758c214d748eec06abd67c730b2efc3c49ea5f8b3100e06",
    "locator": "fixtures/operating-bundle-manifest.json",
    "media_type": "application/json",
    "display_version": "fixture-1"
  },
  "candidate_semantic_snapshot": {
    "sha256": "sha256:90c569fc180b660cae3ab2f3ca57a6390008e1bf827d3d3c6d5e8726a225d6f4",
    "locator": "fixtures/semantic-snapshot.json",
    "media_type": "application/json",
    "display_version": "fixture-1"
  },
  "evaluation_plan": {
    "sha256": "sha256:0027c2fc812e8176ea6238d3aa617dc18fd5cbcf631553f1dd8839d45d5dcce3",
    "locator": "fixture:evaluation-plan",
    "media_type": "application/octet-stream",
    "display_version": "fixture-1"
  },
  "evaluator_build": {
    "sha256": "sha256:d4ab3f04954e22c67a539c89007e007eba916c7e0b85100100a650ce692fad84",
    "locator": "fixture:evaluator-build",
    "media_type": "application/octet-stream",
    "display_version": "fixture-1"
  },
  "evaluator_configuration": {
    "sha256": "sha256:bb88a06f013b4c940942ded0a82442777018b9ddaaff3865f5ba4867f7e90fb7",
    "locator": "fixture:evaluator-configuration",
    "media_type": "application/octet-stream",
    "display_version": "fixture-1"
  },
  "environment_specification": {
    "sha256": "sha256:f19dfdafe78eff8b69fbcd25901f54a0856793eed37384f60c28a61271904cf5",
    "locator": "fixture:isolated-evaluation-environment",
    "media_type": "application/octet-stream",
    "display_version": "fixture-1"
  },
  "knowledge_inputs": [
    {
      "read_view_id": "snapshot:800",
      "snapshot_artifact": {
        "sha256": "sha256:602eb4e8b4ecf391b2c4a607bf43f94951783f156c7282073f0b6fad2ab07be9",
        "locator": "fixture:evaluation-knowledge-snapshot",
        "media_type": "application/octet-stream",
        "display_version": "fixture-1"
      },
      "consistency": "exact_snapshot",
      "freshness_policy": {
        "sha256": "sha256:c488e8431e03a174fec388460f57971655579c5527de174f3d7b04828d2bc247",
        "locator": "fixture:evaluation-freshness-policy",
        "media_type": "application/octet-stream",
        "display_version": "fixture-1"
      }
    }
  ],
  "test_inputs": [
    {
      "sha256": "sha256:0986eb9c4b68c4389cc49896be7da546e8ff36ae52de6446a0378b4824a8a672",
      "locator": "fixture:coupled-machine-reset-counterexample",
      "media_type": "application/octet-stream",
      "display_version": "fixture-1"
    }
  ],
  "checks": [
    {
      "check_id": "authority-case-42",
      "kind": "authority_delta",
      "status": "pass",
      "scope": "Named maintenance assets M17, M18, and C4; diagnostic read access does not authorize reset or interruption.",
      "result_artifact": {
        "sha256": "sha256:2de6306d017488fa0348e65aee328d5dad322f9856b869f966e20f175d9653cf",
        "locator": "fixture:authority-check-result",
        "media_type": "application/octet-stream",
        "display_version": "fixture-1"
      },
      "limitations": [
        "Illustrative fixture only; no test execution claimed."
      ]
    }
  ],
  "overall_result": "pass_within_declared_scope",
  "authority_delta": {
    "assessment": "expansion_detected",
    "assessment_artifact": {
      "sha256": "sha256:a2d49aff0c3efaba27d72d38e96a5b461f8796b17ac5e3cc69ca29483396adc8",
      "locator": "fixture:authority-impact-analysis",
      "media_type": "application/octet-stream",
      "display_version": "fixture-1"
    },
    "comparison_scope": {
      "sha256": "sha256:0958e0e0f9add1bb67a5af277daeda49838e5e580aeb36533805f6770183d1d7",
      "locator": "fixture:bounded-maintenance-asset-population",
      "media_type": "application/octet-stream",
      "display_version": "fixture-1"
    },
    "new_permissions": [
      "Read diagnostic records for M17, M18, and controller C4 under a scoped grant; no reset or interruption permission is added."
    ],
    "removed_permissions": [],
    "undecided_cases": [],
    "required_grant_ids": [
      "grant-coordinated-diagnostic-read"
    ]
  },
  "unresolved_findings": [],
  "limitations": [
    "Illustrative fixture, not empirical evaluation evidence."
  ],
  "report": {
    "sha256": "sha256:5ada0e24ff735ba1ed2a9bad65e32398a89aec00cf6606262bc0897e9fbe33c0",
    "locator": "fixture:evaluation-report",
    "media_type": "application/octet-stream",
    "display_version": "fixture-1"
  },
  "correlation_id": "change-42"
}
